id_news|diario|title|snippet|time|year|svm_prediction
ecuador_lahora_2018_24|La Hora (Ecuador)|Riesgo País aumenta en Ecuador tras cambio en el Ministerio de ...|Riesgo País aumenta en Ecuador tras cambio en el Ministerio de Finanzas ... los mismos mercados internacionales castiguen a Ecuador y las condiciones de ...|7 Mar. 2018|2018|economi
ecuador_lahora_2018_26|La Hora (Ecuador)|Japón firma acuerdo de ayuda financiera con Ecuador de 70 millones ...|El primer ministro nipón, Shinzo Abe, firmó hoy un acuerdo de ayuda financiera reembolsable con el presidente de Ecuador, Lenín Moreno, por valor de 70 ...|5 Sep. 2018|2018|economi
ecuador_elcomercio_2018_71|El Comercio (Ecuador)|Misión del FMI se quedará en Ecuador hasta julio del 2018|Un equipo del Fondo Monetario Internacional (FMI) permanecerá en Quito por unas dos semanas, para llevar a cabo la revisión anual de las cifras económicas ...|19 Jun. 2018|2018|economi
ecuador_elcomercio_2018_3|El Comercio (Ecuador)|Ecuador expresó formalmente su decisión de convertirse en país ...|El ministro ecuatoriano de Comercio Exterior, Pablo Campana, informó hoy, 23 de julio del 2018, en el marco del V Encuentro de la Alianza del Pacífico que ...|23 Jul. 2018|2018|economi
ecuador_eluniverso_2017_88|El Universo|La CAF aprueba 2 préstamos a Ecuador|El Banco de Desarrollo de América Latina-CAF aprobó dos préstamos para Ecuador por un monto de $ 292 millones, para modernizar la red de carreteras e ...|5 dic. 2017|2017|economi
ecuador_eluniverso_2018_87|El Universo|Ecuador apunta a Alianza del Pacífico ya inversionistas|El ministro de Comercio Exterior, Pablo Campana, señaló que Ecuador busca formar parte de la Alianza del Pacífico y que, en el segundo semestre de este año ...|30 May. 2018|2018|economi
ecuador_elcomercio_2015_23|El Comercio|Críticas nacionales e internacionales a través de redes sociales al ...|Las reacciones al comercial de Ecuador que se transmitió ayer, 1 de febrero del 2015, en el Super Bowl no se hicieron esperar. Entre estas reacciones también ...|2 Feb. 2015|2015|economi
ecuador_elcomercio_2015_46|El Comercio|Ecuador y Bielorrusia impulsan cooperación para un desarrollo ...|Espinosa explicó que en 2013 Ecuador y Bielorrusia acordaron crear una ... varios instrumentos en materia de ciencia y tecnología, comercio exterior, minería, ...|11 Feb. 2015|2015|economi
ecuador_elcomercio_2017_66|El Comercio (Ecuador)|Rafael Correa: 'a corto y mediano plazo es una utopía salir de la ...|“A corto y mediano plazos es una utopía salir de la dolarización. Lo que sí se podría hacer es una moneda regional, pero eso será cosa de décadas”, dijo el ...|17 ene. 2017|2017|economi
ecuador_elcomercio_2018_22|El Comercio (Ecuador)|Ecuador estará en el V Encuentro Empresarial de la Alianza del Pacífico|Una delegación gremial ecuatoriana participará el lunes 23 de julio del 2018 en el V Encuentro Empresarial de la Alianza del Pacífico, que se realiza en Puerto ...|20 Jul. 2018|2018|economi
ecuador_elcomercio_2018_48|El Comercio|Seguridad fronteriza, comercio y cooperación energética, los ejes del ...|Además, dijo que Ecuador seguirá apoyando a los cerca de 60 000 ciudadanos colombianos que residen en el país. El mandatario señaló que en el Gabinete ...|4 dic. 2018|2018|economi
ecuador_elcomercio_2018_85|El Comercio (Ecuador)|El edificio sede de la Unasur financiado por Ecuador será una ...|El presidente de Ecuador, Lenín Moreno, anunció que el edificio donde funcionó por más de tres años la sede de la Unión de Naciones Suramericanas ...|6 Jul. 2018|2018|economi
ecuador_elcomercio_2018_88|El Comercio (Ecuador)|Richard Martínez va de la Cámara de Industrias al Ministerio de ...|Martínez es economista de la Universidad Católica del Ecuador, con un Executive ... y Comercio Internacional por la Universidad Miguel de Cervantes en Chile.|15 May. 2018|2018|economi
ecuador_eluniverso_2015_24|El Universo|Posible salida de Ecuador de la CAN inquieta a empresarios|“Si Ecuador sale de la CAN y los productos manufactureros, sobre todo ecuatorianos, que el día de hoy entran al mercado colombiano y peruano sin aranceles, ...|11 Feb. 2015|2015|economi
ecuador_eluniverso_2018_83|El Universo|Ecuador reduce subsidios de gasolina extra y ecopaís|El diésel para transporte público y gas de uso doméstico no se verán modificados, dijo el ministro de Economía, Richard Martínez, al mismo tiempo que anunció ...|18 dic. 2018|2018|economi
ecuador_lahora_2017_54|La Hora (Ecuador)|Siguen los cuestionamientos al plan económico del Gobierno de ...|Siguen los cuestionamientos al plan económico del Gobierno de Ecuador ... continuos créditos otorgados al Gobierno por el Banco Central del Ecuador (BCE).|13 Oct. 2017|2017|economi